{
	"entityType": "collection",
    "entityName": "fixedfolios001",
    "entityId": "urn:publication:com.viewerdemo_web_r33_2:collection:fixedfolios001",
    "version": 1405707625,
    "published": "2014-04-30T04:00:00Z",
    "created": "2014-04-30T03:56:00Z",
    "modified": "2014-04-30T03:59:00Z",
    "title": "collection for demo content for r32",
    "description": "a first approach of creating demo data for viewer teams to consume",
    "keywords": [
        "art",
        "style",
        "feed"
    ],
    "analyticsId": "EAN233123",
    "productIds": [
        "com.viewerdemo_web_r33_2.product.ABC0000BG12I",
        "com.viewerdemo_web_r33_2.product.ABC0000BG12I"
    ],
    "analyticsId": "342",
    "department" : "design",
    "byline": "by fred walters, photograph and video by marco grob",
    "bylineUrl": "www.somemagazine.com/byline",
	"isSpecialContent" : true,
    "isAd": false,
	"adType" : "static",
	"adCategory" : "technology",
	"advertiser" : "advertiser name",
	"importance": "high",
    "isIssue" : false,
    "navigation" : "first",
    "maxSize" : 200,
    "lateralSwipe" : false,
    "_links": {
        "self": {
            "href": "/publications/com.viewerdemo_web_r33_2/collections/fixedfolios001;version=1405707625"
        },
        "latestVersion": {
            "href": "/publications/com.viewerdemo_web_r33_2/collections/fixedfolios001"
        },
        "elements" : {
        	"href": "/publications/com.viewerdemo_web_r33_2/collections/fixedfolios001;version=1405707625/elements",
            "type": "application/json",
            "version": 1405707625
		}
    }
}
